{
  "schema_version": "1.0.0",
  "road_id": "DEMO-ROAD-101",
  "name": "Arterial Bridge Corridor East",
  "road_type": "bridge",
  "status": "BLOCKED",
  "accessibility": "IMPASSABLE",
  "geometry": {
    "type": "LineString",
    "coordinates": [
      [80.2650, 13.0810],
      [80.2707, 13.0827],
      [80.2750, 13.0850]
    ]
  },
  "speed_limit_kmh": 40.0,
  "capacity_vehicles_per_hour": 800,
  "flood_depth_cm": 95.0,
  "last_updated": "2026-09-19T14:35:00Z",
  "source": "synthetic_demo"
}
